reviewId,content,score,at,thumbsUpCount,content_cleaned,sentiment,topic
cf75a0f8-823a-4a73-8cc0-dd5099d53292,nice experience,5,2025-01-09 10:43:53,0,nice experience,1,User Experience
11b14078-3d34-4524-b77b-1896832f7506,Poor,2,2025-01-09 10:15:20,0,poor,0,Matches
62983208-0400-477e-befa-abf9fab1b046,Good,2,2025-01-09 10:14:29,0,good,1,Support
5d685059-423a-42a8-bc38-9f377508e228,bots,1,2025-01-09 10:12:57,0,bot,1,Matches
bc5fb768-bb01-4a7a-b17e-9b624a9dfcd8,Works great!,5,2025-01-09 10:12:07,0,work great,1,Performance
95a448aa-cbff-4c7a-83c3-26c76fd3e7fb,After I paid for a boost I got no likes for over a week and a half and then it deleted my account out of nowhere,1,2025-01-09 10:01:27,1,paid boost got like week half deleted account nowhere,0,Matches
7470b393-2af7-4f7e-ae18-afbd8fc360e4,Useless App to use. It's a scam,1,2025-01-09 09:57:01,0,useless app use scam,1,Spam/Bots
27418280-c352-49ff-9c48-cd3309956ca5,good 👍,5,2025-01-09 09:54:40,0,good,1,Performance
ab1960fa-82c9-4cb3-af4b-9ec7319dee7a,Bad app for date someone,1,2025-01-09 09:35:12,0,bad app date someone,0,User Experience
d838edca-c5a1-422f-9bf5-5b0b8f65f71e,"You look at the free experience, then the prices for premium which is broken up into tiers. Then look at the prices and realise it offers less than years ago. Swiped right on 1000 people with the highest tier and got one match in 2 hours and it was 4000 miles away like thanks. I got 11 likes in the first 6 hours on free to tempt me and none were my type or transsexuals or people twice plus my size, which isn't an issue but I'm not attracted to and there's no premium function to avoid that.",1,2025-01-09 09:26:01,13,look free experience price premium broken tier look price realise offer less year ago swiped right people highest tier got one match hour mile away like thanks got like first hour free tempt none type transsexual people twice plus size issue attracted premium function avoid,0,Pricing
293646a2-e601-4943-a85b-d576a68731ec,Love wins when you get a perfect match 💞,5,2025-01-09 09:11:08,0,love win get perfect match,1,Matches
7cf4c638-de8d-4318-b96c-10bb4288b163,very nice,5,2025-01-09 08:56:34,0,nice,1,Content Moderation
c44c5b6d-807d-4089-bf3d-96f8f1a80183,"I've been on Tinder for over a week now and I've not gotten a single match. Yes, I'm using the free version, but I like profiles every now and then (every day). Another annoying thing about all of this is that, ALL of the profiles I've previously liked ALWAYS circle back and I have to like them again. If I'm not exaggerating, I'd say that I've liked about 70 profiles at least 3 different times in this little time I've been here. For the record, my 'Discovery' has been on. Please help me!",1,2025-01-09 08:55:43,3,tinder week gotten single match yes using free version like profile every every day another annoying thing profile previously liked always circle back like exaggerating say liked profile least different time little time record discovery please help,1,Matches
496d7e61-d529-4f49-bae0-c876c352228d,not for men,1,2025-01-09 08:44:30,0,men,1,Content Moderation
a2aec05e-cdca-40be-a1d8-5c148bdc1b10,perfekt,5,2025-01-09 08:33:02,0,perfekt,1,Performance
592c3b76-f79d-49c1-ae70-ef5cad6930f5,Guys don't take premium membership and dont spend too much time in tinder! It's full of fake and non active profiles and if you take premium they will give you only few profiles and so many non active profiles this app is not good comparing to bumble,1,2025-01-09 08:18:09,0,guy take premium membership dont spend much time tinder full fake non active profile take premium give profile many non active profile app good comparing bumble,1,Content Moderation
ad90185d-abe4-4c76-9a4a-fecee5fe6c9c,fun,5,2025-01-09 07:51:25,0,fun,1,Support
35a033e6-c508-4525-8bad-eaee8e0e6e73,Doesn't allow me to delete profile,1,2025-01-09 07:31:48,0,allow delete profile,1,Privacy
db7fbff9-2623-4993-bcc5-43fe538bc0a5,good,4,2025-01-09 07:07:53,0,good,1,Support
36a4eebc-69da-4d85-92f9-2109192df0b6,It's a nice to use for dating,5,2025-01-09 06:53:12,0,nice use dating,1,Matches
e5189d26-687d-4bd1-bdea-d186178056ee,"Money grab, nothing else.",1,2025-01-09 05:54:33,0,money grab nothing else,1,Matches
76817412-d5c5-4b62-86cc-029eb5487299,They banned me for having standards,1,2025-01-09 05:49:37,0,banned standard,0,Content Moderation
9c6ebb33-4dae-4d66-9ddb-f552e043862c,would love to see better girls and profiles and girls that are willing to respond,4,2025-01-09 05:20:24,0,would love see better girl profile girl willing respond,1,User Experience
07d3491a-b58b-4cde-a9c7-01fae3bd10f2,would be cool if you got more likes,3,2025-01-09 05:14:35,0,would cool got like,1,Support
5579b0a1-6310-4d43-912e-55a9b673f009,Someone reported me for something.. idk what I did. .. when I didn't offend none. But bc I didn't like them they got me banned . That'd really cool you don't bother to ask what happened.. if I could give zero 🌟 I would .. even negative!!,1,2025-01-09 05:09:38,1,someone reported something idk offend none bc like got banned really cool bother ask happened could give zero would even negative,0,Support
fc8e5826-38c5-4231-8f5a-7e754c4cb6ea,Shadow banned for NO REASON. Making me spend money when its not even showing me to others. Ive sunk THOUSANDS OF DOLLARS INTO THIS APP. DO NOT RECCOMEND. THEY TREAT TOP PAYING CUSTOMERS LIKE ME LIKE DIRT. WE MATTER TOO.,1,2025-01-09 04:59:06,1,shadow banned reason making spend money even showing others ive sunk thousand dollar app reccomend treat top paying customer like like dirt matter,0,Spam/Bots
3267fdae-8651-4e9f-8178-432a62d0e24d,No messaging done so far.no communication so far.only demand money .very bad experience in this app,1,2025-01-09 04:54:19,0,messaging done far communication far demand money bad experience app,1,User Experience
2f1f7307-d91e-418c-a15c-1674976f660e,gets worse and worse,1,2025-01-09 04:52:53,1,get worse worse,0,Matches
1fb1ca06-0eb7-4e6c-a3a5-15d4000ac1d6,nice,5,2025-01-09 04:36:49,0,nice,1,Support
7874af16-54ac-4fef-b458-bac1b6b29420,"So sad, I got banned because I respectfully put in my bio that I'm not interested in meeting trans people. I also added no offense, because I do hate anyone, I just have my preference and I was banned because of it. How unfair is that? Everyone can have and state a preference except heterosexual people? Smfh! I want a refund on my tinder gold.",1,2025-01-09 04:19:23,1,sad got banned respectfully put bio interested meeting trans people also added offense hate anyone preference banned unfair everyone state preference except heterosexual people smfh want refund tinder gold,0,Privacy
321cf7c2-da06-4d68-b19f-0be724bee255,so far so good,5,2025-01-09 03:59:28,0,far good,1,Content Moderation
8ac3c94f-6b94-4103-a5b6-aaa1259b94b2,"It's a rip off. The minute you stop paying for the extras, the ""likes"" start coming in. When you pay to see those likes, they are mostly foreign or 2000 miles away. The algorithms they have in place is designed to get you to pay and to continue to pay. When you go the free route you often end up seeing the same people, whether you swipe left or right. The folks running this app only care about how they can take more of your money, not about helping you match.",2,2025-01-09 03:46:31,0,rip minute stop paying extra like start coming pay see like mostly foreign mile away algorithm place designed get pay continue pay go free route often end seeing people whether swipe left right folk running app care take money helping match,0,User Experience
276b8793-80da-4210-8ff0-62248300b799,Fix your app guys it used to be ok now it's just buggy trash with high pay walls,1,2025-01-09 03:33:42,0,fix app guy used ok buggy trash high pay wall,1,Bugs
efadfeda-3dbe-4d5e-9d81-7ba79607928b,great,4,2025-01-09 03:28:10,0,great,1,Performance
8531fcf3-4d98-4120-9bf8-ca9ef43669e5,nice,5,2025-01-09 02:59:39,0,nice,1,Support
d6853290-4f45-40ea-a64e-57545c9befd2,Used for 4 yrs only landed 1 date. For the record i am an attractive person. Connect with pstar level girls all the time. No problem picking girls up in person. Just giving other people reading this the picture. This app has achieved nothing but take my money,1,2025-01-09 02:56:04,0,used yr landed date record attractive person connect pstar level girl time problem picking girl person giving people reading picture app achieved nothing take money,1,User Experience
c3e43a2f-f519-4470-980d-5f9da3f00043,With no explaination my account got banned for no reason. I already contacted customer support but all they kept saying that my account is banned but couldn't give me an exact reason... i never violated anything nor harassed anyone,1,2025-01-09 02:50:03,1,explaination account got banned reason already contacted customer support kept saying account banned give exact reason never violated anything harassed anyone,0,Support
0f3ece8d-c3f3-47c0-a602-44b378da2285,"Got a boost but didn't activate it. Yet suddenly I got a notification saying my boost had been used.. yet I never tapped to do that. Scammy. On top of that the app is full of fake AI generated profiles, been like this for months now which likely suggests it's tinder doing this to inflate user numbers. App is garbage.",1,2025-01-09 02:49:07,0,got boost activate yet suddenly got notification saying boost used yet never tapped scammy top app full fake ai generated profile like month likely suggests tinder inflate user number app garbage,0,Spam/Bots
9fabb888-48bf-4701-b3e7-93484ad8d2bc,"You are limited to only a few likes. Even if someone wanted to like you, they can't. Don't get discouraged if you don't get any likes.",1,2025-01-09 02:36:09,0,limited like even someone wanted like get discouraged get like,1,User Experience
f2aed40c-8291-4dda-b246-15b7a3947a6d,nice app,5,2025-01-09 02:33:42,0,nice app,1,User Experience
3fa14797-69c4-47f2-a0e6-969547532301,"The only people I match with are either Bots, or people that sell their Only Fans or Escort services. Tinder doesn't do anything to prevent this and makes it a nearly unusable experience for any normal guy. I've tried this app for months and it only seems to get worse. I thought this was a dating app, not a sex service app to promote illegal prostitution. Honestly don't know how this is legal.",1,2025-01-09 02:21:38,1,people match either bot people sell fan escort service tinder anything prevent make nearly unusable experience normal guy tried app month seems get worse thought dating app sex service app promote illegal prostitution honestly know legal,0,Spam/Bots
34263f0a-d8c9-47b7-b54e-104369864ab1,nice app,1,2025-01-09 02:00:40,0,nice app,1,User Experience
1ce6e021-f598-4c7c-8f10-3848bb02f253,This app has gone down hill! Definitely not worth paying nearly $80 for a month subscription.. tinder is not worth $80 a month! This app has become expensive and not worth using!,1,2025-01-09 01:20:15,0,app gone hill definitely worth paying nearly month subscription tinder worth month app become expensive worth using,0,Pricing
ee86d491-0eb8-4f74-a1f6-c5a3fa2ba4a8,The app will not match you with anyone until you buy premium FYI,1,2025-01-09 00:56:14,0,app match anyone buy premium fyi,1,Pricing
aaf445a1-7d10-402a-bf73-5c54d961e4e4,I'm happy this app,5,2025-01-09 00:38:01,0,happy app,1,User Experience
968aeac1-b78e-4d60-b92e-dc5dc64b6826,"Despite having filters so to only see other gay men, 70% of the people on my feed are women or straight men",1,2025-01-09 00:17:51,0,despite filter see gay men people feed woman straight men,0,Support
36d5ed21-54df-4824-87fb-83dc0fad7adb,𝕚𝕥'𝕤 𝕨𝕠𝕣𝕜𝕤 𝕧𝕖𝕣𝕪 𝕨𝕖𝕝,5,2025-01-09 00:14:39,0,,1,Matches
38ae561d-493e-49a2-b28a-ac0bd589ae20,can't sort by location but lots of long term not only short term,3,2025-01-09 00:09:58,0,sort location lot long term short term,0,Support
7cbba72c-dcd4-48f0-96ad-47621ffd5c25,It's not signing me in,2,2025-01-08 23:58:30,0,signing,1,User Experience
86c90c2f-af75-42be-a5e7-e2abdca2ac5c,am about to have dinner at someone place,5,2025-01-08 23:48:19,0,dinner someone place,1,Content Moderation
ed27314e-2d5e-4c97-b939-3621f79a4549,the pay to play shiiiii is rather obnoxious,3,2025-01-08 23:42:46,0,pay play shiiiii rather obnoxious,1,Pricing
4cfdce7e-5dcb-443c-9b3b-54d650586d2b,"It attracts a certain kind of people, but I guess that can't be helped",3,2025-01-08 23:39:15,0,attracts certain kind people guess helped,1,Support
95fb52c8-6e79-4bf5-89bc-3d58650c1e60,Tinder is big scam and their customer care is useless. I have Tinder Plus. I have verified profile and decided to change profile photo. One day after they decided to verify me again but it's about 7 days and my profile is still under review! Two days ago I wrote to customer care and they claim that my profile is ready for use which is simply a lie!,1,2025-01-08 23:33:33,2,tinder big scam customer care useless tinder plus verified profile decided change profile photo one day decided verify day profile still review two day ago wrote customer care claim profile ready use simply lie,0,Spam/Bots
d58b0ffb-6335-43bd-8e6d-e268976bc004,people there are fake they harass lady's,1,2025-01-08 23:19:07,0,people fake harass lady,0,Spam/Bots
fb2197c0-9f0b-46ea-93f5-ded1a39e835d,❤️,5,2025-01-08 22:51:02,0,,1,Support
b632702a-4a2c-4a93-996e-38a2d96e0d39,Only works if you pay for platinum and it's not worth it. Say hi to people IRL!,1,2025-01-08 22:30:17,0,work pay platinum worth say hi people irl,0,Pricing
a4a569d6-b751-486d-9ce7-45d7c5b35eb0,Very very sweet but please 🙏 let be seeing people that likes without subscription,5,2025-01-08 22:29:37,1,sweet please let seeing people like without subscription,1,Privacy
d4d2b63c-5550-4d0e-b254-69bd5939aed3,🥰🥰🥰🥰🥰💞💞💞💞💞🙏,5,2025-01-08 22:23:17,0,,1,Support
3d61c7a4-d71e-4172-8897-5e4f51bb69da,بصح,5,2025-01-08 21:43:06,0,,1,Support
637b2572-4648-43d2-ad1b-ac6e57fb2453,"hey, after 2 days of having an account it stops showing my profile to people, what gives?",2,2025-01-08 21:37:49,1,hey day account stop showing profile people give,0,Privacy
0f1965ab-d6f9-4da4-afcf-8d1812903db8,"Every single person on this app is a scammer. I don't know how they stay in business. Such a waste of time and money. I'm not bitter. I am a very attractive man with a good profile. And there is no way to report them unless they directly ask for money. But if you're not an idiot it's very easy to figure out before it gets to that point. I am convinced that it is tinder who is ""liking"" you to keep you hanging on.",1,2025-01-08 21:26:01,3,every single person app scammer know stay business waste time money bitter attractive man good profile way report unless directly ask money idiot easy figure get point convinced tinder liking keep hanging,0,Performance
2640307a-b8e2-45ed-9e0f-61ea24fd036a,it's very good app for dating,5,2025-01-08 21:22:59,0,good app dating,1,Matches
4976970a-d54f-4fdb-96df-3da78ba44aa8,Sexist app (guys are the victims),1,2025-01-08 21:21:15,1,sexist app guy victim,0,User Experience
b3e39195-705d-4ce1-8fd2-31354c649669,Don't install this app. Especially if you're a man. Useless and waste of time. And they will ask you to pay to get matches.,1,2025-01-08 21:18:54,1,install app especially man useless waste time ask pay get match,0,Matches
c7b9ebb9-f902-4dd7-ac7d-16d532709a3a,It's a scam. You'll get over ten likes while they are hidden then you buy tinder gold to see them. you'll realise they're all fake asian women. You'll get very little likes until your tinder gold runs out and as soon as it runs out you'll get loads of hidden likes again. Surprised trading standards let this happen.,1,2025-01-08 21:12:46,4,scam get ten like hidden buy tinder gold see realise fake asian woman get little like tinder gold run soon run get load hidden like surprised trading standard let happen,0,Spam/Bots
65af751e-0c70-43eb-9046-f46126cf8803,The app is deeply broken,1,2025-01-08 21:08:44,0,app deeply broken,0,User Experience
f7636421-77a0-43e9-b28f-bbdcdcaea42d,no matches,3,2025-01-08 20:39:07,0,match,1,Matches
b11d66dc-fa55-4510-b82a-b13adca052b9,FULL OF PROSTITUTES,1,2025-01-08 20:36:45,5,full prostitute,1,Pricing
651a2591-6642-4968-9fb9-9a21526bc498,why my tinder is not opening i want replay,1,2025-01-08 20:34:22,1,tinder opening want replay,1,User Experience
d2386af0-3094-40bb-a6c1-44fb6c3eeff4,"Data from users from this app are included in the recent hack on data broker gravy analytics. This data is still deliberately sold by tinder to data brokers defying the EU privacy act. This app is an danger to public safety and an security risk. It's also kinda bad at getting me laid like cmone, only having likes is soo 2019... 🙄 do better smh..",1,2025-01-08 20:18:22,1,data user app included recent hack data broker gravy analytics data still deliberately sold tinder data broker defying eu privacy act app danger public safety security risk also kinda bad getting laid like cmone like soo better smh,0,Privacy
0a01f6b0-e1e9-4a6d-ad86-520503d09650,Awesome,5,2025-01-08 20:05:24,0,awesome,1,Support
1d5b5cec-490c-4d56-b866-836d51452c61,I will not forget the first app ever help me like google earth. For Supporting google,5,2025-01-08 20:00:50,1,forget first app ever help like google earth supporting google,1,Support
c93bfbed-4896-4dfc-9186-8c95b12f0151,very nice guy,5,2025-01-08 19:59:45,0,nice guy,1,Content Moderation
fc88883c-da4c-4eb0-827a-7658b4e74136,I paid to use the app and now not even in the middle of the subscription it doesn't let me login for no obvious reasons if this goes on I will cancel my subscription.,1,2025-01-08 19:41:05,1,paid use app even middle subscription let login obvious reason go cancel subscription,0,User Experience
deb1a759-6e74-44fd-9ab6-935b68519a00,1/25: So funny that this app blocked me for violating usage terms when I've not had any communication with anyone on this app in weeks. Probably a good thing to just delete it from my phone. Nothing but spam and fake profiles on here anyway so it's ridiculous they don't do any sort of secure monitoring or verification whatsoever. Save yourself an awful experience and don't download this piece of junk.,1,2025-01-08 19:37:42,2,funny app blocked violating usage term communication anyone app week probably good thing delete phone nothing spam fake profile anyway ridiculous sort secure monitoring verification whatsoever save awful experience download piece junk,0,Spam/Bots
d428bc47-d00b-403c-b4fd-092cf644bec0,"Support Team never ever repone me for fixing the problem that I have. I paid my account as tinder plus. I thought I would have good experiences on Tinder. I've been on Tinder for 2 months It has asked me to verify who I am. Yes I did it. I've been trying to contact any support teams, but no one resolved me the problem. My messages don't send through the matches. Matching doesn't work. My account has been inaccurate I believe. Tinder is a scam. Got money and block you later.",1,2025-01-08 19:35:02,4,support team never ever repone fixing problem paid account tinder plus thought would good experience tinder tinder month asked verify yes trying contact support team one resolved problem message send match matching work account inaccurate believe tinder scam got money block later,0,Support
c442645c-a736-4b44-9bf9-478bd5c70a41,good,5,2025-01-08 18:56:49,0,good,1,Support
0f9ee944-adbe-4443-8183-e5b9db4484b0,supar,1,2025-01-08 18:56:42,0,supar,1,Performance
bc40182e-7bb3-433d-84a8-eba71ef31e30,"Sucks, it's a money racket. $40 for no likes or matches lol charge you extra for your profile to be seen by people",1,2025-01-08 18:54:01,3,suck money racket like match lol charge extra profile seen people,0,Matches
b8db7b51-979f-4726-8c9f-9d84f2e6736b,There us ABSOLUTELY NOTHUNG THERE TO SEE,1,2025-01-08 18:51:51,0,u absolutely nothung see,0,Privacy
6e5af3fe-e70a-433a-9f5e-3af65bab57fd,met my match,5,2025-01-08 18:49:53,0,met match,1,Matches
96b28d86-4e0a-40b7-b8be-1fdab815cf60,"Can't get a match, but in person it's the complete opposite. Just go out more it's what I do, this app made me feel terrible about myself it's crazy.",1,2025-01-08 18:45:46,1,get match person complete opposite go app made feel terrible crazy,0,Matches
4cb62561-a8ca-4109-9162-95da7d92c032,best app,5,2025-01-08 18:33:50,0,best app,1,User Experience
f13c74f5-23f1-4f9c-9d1d-41bc008c4a9e,It good,5,2025-01-08 18:26:20,0,good,1,Performance
29478f1c-3da4-4f46-a6d3-c379d1c60817,nic,5,2025-01-08 18:16:51,0,nic,1,Support
161a9db9-b3ab-4042-a42a-f84f3114c618,all apps Data!,5,2025-01-08 18:08:51,0,apps data,1,Privacy
c28cb88a-f872-4f6f-9bad-23ff2c9c5fbc,good,5,2025-01-08 17:48:47,0,good,1,Support
f0484b7f-235d-41a7-9d47-1eb42ad8f6d1,I've been permanently banned.,1,2025-01-08 17:44:17,2,permanently banned,0,Content Moderation
6f387d3f-cc4d-4594-b537-85eaa6df5aaa,it's the first time I use an app like this but so far so good,3,2025-01-08 17:40:57,0,first time use app like far good,1,User Experience
5f88cad5-338a-4934-8ea2-277e0f4283a0,"I remember when I first logged on to tinder I had no issues, would get matches, rarely got any bots. That was about 6 years ago. Now it's full of only fan models, bots. And the people that match with you they decide to add their profile to the back of the list of people so that you waste your time and money on getting the premium. The report feature is a sham. Suspicious profiles you go to report them and you cannot. So these random unknown people get to live on in this app",1,2025-01-08 17:01:02,26,remember first logged tinder issue would get match rarely got bot year ago full fan model bot people match decide add profile back list people waste time money getting premium report feature sham suspicious profile go report cannot random unknown people get live app,0,Spam/Bots
9bc5dcd3-f207-4797-a106-19f874178035,nice place,5,2025-01-08 16:49:18,0,nice place,1,Content Moderation
94daea0e-9670-41a6-a201-c777a8fd1f2d,"My app is bugging. I already tried reinstalling, but it's still the same. When i visit someone's profile while on chat, it just goes back to chat, hence not seeing the profile of my match. Help, please.",1,2025-01-08 16:41:08,0,app bugging already tried reinstalling still visit someone profile chat go back chat hence seeing profile match help please,1,Bugs
2fe5fa3b-a7fc-42e9-a8e0-f1dd48ccf059,Good,5,2025-01-08 16:34:24,0,good,1,Support
13c2bc13-f650-4dd4-88c3-3b6872ebe242,why i gotta pay for everything if I wanted to do that I'd go to the red light district :(,1,2025-01-08 16:30:18,1,gotta pay everything wanted go red light district,1,Pricing
604d7b7a-46c9-4157-93ca-4311b6d333ee,good,5,2025-01-08 16:19:20,0,good,1,Support
3c0e6686-e6fe-490c-8b8d-5f879a904658,very good,4,2025-01-08 16:11:31,0,good,1,Performance
c049a5ac-9f9d-4fbf-a77e-2828887cb810,"Hardly any matches, the paid stuff doesn't work either. Boosts are pointless unless you want someone 6000 miles away liking you. Waste of time, don't pay but then you don't get any hits. Used to be good, rubbish now",1,2025-01-08 16:03:14,0,hardly match paid stuff work either boost pointless unless want someone mile away liking waste time pay get hit used good rubbish,0,Matches
1246af5c-a5a0-4ec9-a3f9-c04ca6e7b124,Banned for reporting misuse of men signing up as women. I only wanted to find straight women and reported a misuse but that's hate apparently. Don't think Grindr would accept women signing up as gay men..,1,2025-01-08 15:29:15,1,banned reporting misuse men signing woman wanted find straight woman reported misuse hate apparently think grindr would accept woman signing gay men,0,Privacy
adc6977c-928e-4a9e-a7eb-f2b46545716c,"Tell me why I paid for the Gold Subscription (1st Jan) only to use for 2days,after that it keeps on showing that I need to reactivate with money again. Back and forth on emails and still am unable to access the Gold Sub benefits. Fix it or refund me my money or explain why I need to pay for reactivation!!!",2,2025-01-08 15:27:23,0,tell paid gold subscription st jan use day keep showing need reactivate money back forth email still unable access gold sub benefit fix refund money explain need pay reactivation,0,Accessibility
eb335956-d0c7-41bf-b5ef-1a48e6b2118d,"Have been paying for premium tinder for 2 months and keep on seeing exact same people each time I open the app. No matches, no messages going through to the people I liked. Have done all the troubleshooting and have reported it numerous times and still no feedback from the support team.",1,2025-01-08 15:00:18,0,paying premium tinder month keep seeing exact people time open app match message going people liked done troubleshooting reported numerous time still feedback support team,0,Matches
b6912fc5-8d50-4bf7-b462-cd2782a5a9d6,"I've been on tinder for awhile, totally not worth it. These guys are so rude and disrespectful on this app, and if you don't abide what they say they will report you and have you banned. So I'm banned because I wouldn't have sex with a guy one night.",1,2025-01-08 14:52:04,0,tinder awhile totally worth guy rude disrespectful app abide say report banned banned sex guy one night,0,User Experience
56803c82-a54e-47f0-8548-c227b5188631,It is just to expensive you get fleeced every time you want to see who liked you!!!,1,2025-01-08 14:36:03,0,expensive get fleeced every time want see liked,1,Pricing
a434f5ea-cfbe-472a-985c-ad600caa3955,Sensational,5,2025-01-08 14:34:24,0,sensational,0,Performance
debb63d3-8ffd-43b2-ab87-4a139e91c72f,Koi paise dena mat fek hai sab ladake bhare h sirf,1,2025-01-08 14:12:34,0,koi paisa dena mat fek hai sab ladake bhare h sirf,1,Matches
a76cf031-f769-4245-9a74-0e743c8994cd,Horrible customer service. Not worth paying for.,1,2025-01-08 13:46:08,0,horrible customer service worth paying,0,User Experience
4bc18393-8128-4564-b695-dc12dc3aac41,i cant make any judgement for now just joined,1,2025-01-08 13:25:26,0,cant make judgement joined,1,Support
