reviewId,content,score,at,thumbsUpCount,content_cleaned,sentiment,topic
b56c2f74-0489-4908-81dc-f5967911bf15,"Used a boost on its own accord with no input which is what inspired my review. The subscriptions are abhorrently high because of the monopoly of the dating app users. Generally there is no way to express urself through this app only by looks, sex sells and is easiest way to sell your app to the general public, but being the leader of dating apps, they should lead by example and their example is that only looks matter which is why I think this app is the catalyst of the declining birth rates.",1,2025-01-04 23:47:51,1,used boost accord input inspired review subscription abhorrently high monopoly dating app user generally way express urself app look sex sell easiest way sell app general public leader dating apps lead example example look matter think app catalyst declining birth rate,0,Support
011cbee9-399c-4683-bda5-8a1a97f6e198,Received lots of likes after installing app. Then I did not receive any likes after purchasing gold. Looks like a scam.,1,2025-01-04 23:39:37,1,received lot like installing app receive like purchasing gold look like scam,0,Spam/Bots
52039f7d-7609-45de-b1f9-c337cc2b1509,"It's a scam app, pay subscription zero likes, the minute the subscription is up the likes just flow like no tomorrow",1,2025-01-04 23:32:04,2,scam app pay subscription zero like minute subscription like flow like tomorrow,0,Pricing
a7ecfe25-3d24-44b1-936e-5f4b3131a6b8,it's an awful lot of money to pay to get constantly rejected by women. Assuming you're an ugly chud like me,2,2025-01-04 23:28:06,2,awful lot money pay get constantly rejected woman assuming ugly chud like,1,Pricing
c6a61b99-ee13-4441-8533-05067b9ec8e2,Una stella perché il mio primo match era trans #scam,1,2025-01-04 23:13:05,2,una stella perch il mio primo match era trans scam,1,Matches
55781ea2-5ec9-471d-8679-41878584e337,"It keeps saying I have new matches but when I open the app the matches are not there. I then bought the platinum subscription and still have not had any conversation after 3 days of constant swiping. I've had plenty on dates on other apps. This is just a scam, they want you to keep paying, to buy the boost and then maybe give them one of your kidneys, who knows. Stay away!",1,2025-01-04 22:33:03,52,keep saying new match open app match bought platinum subscription still conversation day constant swiping plenty date apps scam want keep paying buy boost maybe give one kidney know stay away,0,Spam/Bots
61df2878-48e6-4c01-b736-29da24d907cf,"Paid for tider plus to remove ads, it worked, now there is no more ads, except tinder themselves sending me a ton of ads to pay for other memberships like gold and platinum, I raised a complaint to remove these ads since I paid a lot of money, and it's been more then a week, they don't even reply.",1,2025-01-04 22:15:03,2,paid tider plus remove ad worked ad except tinder sending ton ad pay membership like gold platinum raised complaint remove ad since paid lot money week even reply,0,Spam/Bots
6f153183-c0c7-4fff-a8ea-56e77ecfd6bb,"useless, expensive, and distance to meet anyone is too far.",1,2025-01-04 21:48:59,2,useless expensive distance meet anyone far,1,Matches
bc0b2d11-4186-47b3-8db5-968a72d2d3c2,irreplaceable,5,2025-01-04 21:41:12,0,irreplaceable,1,Matches
f9080498-299d-497d-b1ce-1c903aebe5df,Best among all dating apps thou I haven't found a partner yet,5,2025-01-04 21:23:05,0,best among dating apps thou found partner yet,1,Performance
8aca0c50-f69a-4881-a1c8-dd635fbd974d,Garbage app that will feed you dead profiles and adds unless you pay,1,2025-01-04 21:19:03,2,garbage app feed dead profile add unless pay,0,Spam/Bots
d2816823-9281-4c0d-b307-052a60f29af3,Worst....i paid and enjoying with 0 match,1,2025-01-04 21:01:15,2,worst paid enjoying match,1,Matches
18f7058f-ad33-4373-9822-55b28738115f,Absolutely awful I can't even get on the app keeps loading,1,2025-01-04 20:36:52,0,absolutely awful even get app keep loading,1,Performance
ed8d4fec-879c-4a20-ad72-b7dcae263a7a,if you want to do basically anything you have to buy gold or premium App consists of bots and that's pretty much it,1,2025-01-04 20:33:04,0,want basically anything buy gold premium app consists bot pretty much,1,Pricing
87c836d2-17ea-4f8e-b8fa-8902fd68df46,Perfect,5,2025-01-04 20:29:27,0,perfect,1,Performance
8862ed52-684b-47a2-92cf-1340c381891d,Don't download this app even not able to see a picture who like our profile everything is paid I give 0 star if it possible,1,2025-01-04 20:18:04,0,download app even able see picture like profile everything paid give star possible,0,User Experience
8f23e6a7-b514-411a-888e-96adb8f0c83d,"Absolutely trash of an app, designed to make you pay to meet new people, and from I've heard from the other side of the fence, it's all targeted at guys, supposedly cause we're all thirsty... disgraceful, honestly. I have apparently 2 likes that I can only see if I pay an absurdly large weekly payment, are you serious? And don't it's work on the free version as I've literally gone through supposedly everyone in my area and not seen these 2 likes? Explain that? Scam app, don't even bother",1,2025-01-04 20:07:55,2,absolutely trash app designed make pay meet new people heard side fence targeted guy supposedly cause thirsty disgraceful honestly apparently like see pay absurdly large weekly payment serious work free version literally gone supposedly everyone area seen like explain scam app even bother,0,Pricing
768a5518-788c-4967-9c04-5afb36b82606,If your app is gonna be filled with bots at least let me report fake accounts,1,2025-01-04 20:05:36,0,app gonna filled bot least let report fake account,0,Spam/Bots
30bbd030-180d-4086-bd6f-97aa554f1275,so nice to be here,5,2025-01-04 19:58:27,0,nice,1,Content Moderation
efb56a3d-012b-4e12-9d66-94f1449e4a62,just too expensive,3,2025-01-04 19:51:24,0,expensive,1,Pricing
a7887b6e-8023-4a6b-be71-e029a3df1c5c,I've been trying to cancel my subscription for months and all the steps provided by Google and tinder isn't accessible...they just keep charging me..I feel like I'm being robbed..if I could I'd give negative stars,1,2025-01-04 19:42:11,1,trying cancel subscription month step provided google tinder accessible keep charging feel like robbed could give negative star,0,Accessibility
67e97ef3-4836-44c8-8a83-77c9fd290514,love 💕💕💕💕 this app,5,2025-01-04 19:28:57,0,love app,1,Support
ccccb9e7-e312-43e0-a05d-5e614a86d776,Expensive,1,2025-01-04 19:26:52,0,expensive,1,Pricing
f04433a0-be75-49e0-9812-ce25a513c4e3,acc Keeps cracking,1,2025-01-04 19:13:59,0,acc keep cracking,0,Accessibility
a8e1dd10-a65a-4a39-8773-dc03a940058e,"They have bots like you to get you to pay. It's just obvious after a while. You get likes, you pay the stupid 14$ to see. The like never talks and unmatched within a couple days. Don't get another like until maybe a week tops after week subscription is ended and then the same thing all over. My girl has gotten a couple legitimate matches with girls but even when they're real most of the time they're flakes. If you don't believe me then look at all the profiles making the same joke about it.",1,2025-01-04 19:11:49,1,bot like get pay obvious get like pay stupid see like never talk unmatched within couple day get another like maybe week top week subscription ended thing girl gotten couple legitimate match girl even real time flake believe look profile making joke,0,Spam/Bots
7fb5bcbf-2e21-43fc-9590-5c7385c6c89f,"I got banned from the app for reasons I don't know, and when I did the review the app said approved and ban lifted. So when I try signing in again it's still banned countless times 😠😠😠",1,2025-01-04 18:59:10,0,got banned app reason know review app said approved ban lifted try signing still banned countless time,0,User Experience
4f59745e-7693-43b1-ae77-27813c5dd8ad,Disgusting payment options,1,2025-01-04 18:56:51,2,disgusting payment option,1,Pricing
8726959d-77df-4814-81df-0252c063960f,Sucks wast of time,1,2025-01-04 18:56:16,1,suck wast time,0,Spam/Bots
05d790ae-9b8a-40a6-993f-860c9570e78a,amazing,5,2025-01-04 18:08:34,0,amazing,1,Performance
68781133-3e00-4d13-b6f1-e1283aa17e3f,"Suggestion: Can yall add a way to select if someone is or is not interested in poly relationships? No hate, but I'd like to not waste my time swipping on potential matches that don't align with my preferences. And not put this option behind a membership pay wall.",1,2025-01-04 17:58:52,0,suggestion yall add way select someone interested poly relationship hate like waste time swipping potential match align preference put option behind membership pay wall,0,User Experience
9e71a416-3620-4a0b-889c-65edcc4b9e5c,"have not used the app in a year, then once I created a account (no messages or matches yet my account is shadow band) and I can not even delete my account.",1,2025-01-04 17:48:39,0,used app year created account message match yet account shadow band even delete account,0,Bugs
d73c0794-3b72-4090-b7c1-f14fbd24e3bf,Absolutely awful You pay a lot and no help when you think your profile has been corrupted for some weird reason . Do not buy ..plenty of fish and others apps are much better simple,1,2025-01-04 17:42:46,0,absolutely awful pay lot help think profile corrupted weird reason buy plenty fish others apps much better simple,0,User Experience
65040130-4ab6-4bff-a823-6f25a805723c,Dont waste money on Tinder... Even if you pay your like will not be seen by girls. Its has been 3 months... I am only getting fake profile when i make payment... After that no really or even fake profile come. Waste of time.. try using other apps... Tinder is totally waste of time. I am here to date not for moderate and report profiles... You should make compulsory to take selfie. I dont want to waste my time for reporting profile. Now tinder blocked my account after giving negative reviews.,1,2025-01-04 17:35:26,0,dont waste money tinder even pay like seen girl month getting fake profile make payment really even fake profile come waste time try using apps tinder totally waste time date moderate report profile make compulsory take selfie dont want waste time reporting profile tinder blocked account giving negative review,0,User Experience
fea02bde-b3fa-42e2-b61c-a1d1696adbc0,fantastic app 🤕,5,2025-01-04 17:28:58,0,fantastic app,1,Performance
947b0186-6b79-4b81-85d4-604c4fa7dbaa,This app keeps showing me dudes when I said I want to see women... i get the sense my profile is also somehow shadow banned for no apparent reason.,2,2025-01-04 17:21:45,0,app keep showing dude said want see woman get sense profile also somehow shadow banned apparent reason,0,User Experience
e989c199-c8a9-4fc7-8a03-3742774900b5,Useless,1,2025-01-04 17:14:28,3,useless,1,Spam/Bots
167f0752-1743-4643-b4ed-89e867be7d20,This app seems like a scam to me. I know someone who showed me she liked me and I liked her but we didn't match? How does that work out? Plus I'm certain none of my likes are being sent out as I know a few of them who I've liked and they proved they never received my like I'm not sure if it's intentional or a bug but either way I've been put right off!!!,1,2025-01-04 17:04:06,0,app seems like scam know someone showed liked liked match work plus certain none like sent know liked proved never received like sure intentional bug either way put right,0,Spam/Bots
0fb7a2ef-da2c-4d84-96ff-db966cd91c76,ONLY IF YOU PAY YOU GET LIKES AND MATCHES. IT'S DISGUSTING TINDER ALGORITHM EVERYTHING IS ABOUT MONEY!,1,2025-01-04 17:02:55,40,pay get like match disgusting tinder algorithm everything money,0,Matches
e342787d-0d6b-4c3c-a93b-18c4f615585b,"Solía ser una aplicación buena, la tuve desintalada durante unos meses y al volver me sorprendió la cantidad de perfiles falsos con las mismas características, dos fotos totalmente random, sin descripción alguna y el nombre por lo general son dos letras en mayúsculas. Se ha vuelto una verdadera basura ya que aparecen de cada 3 perfiles 2 son de ese tipo.",1,2025-01-04 17:00:50,0,sol ser una aplicaci n buena la tuve desintalada durante unos meses al volver sorprendi la cantidad de perfiles falsos con la mismas caracter sticas do fotos totalmente random sin descripci n alguna el nombre por lo general son do letras en may sculas se ha vuelto una verdadera basura ya que aparecen de cada perfiles son de ese tipo,1,Support
2ca9d6e7-af18-4055-ad59-21f853cf902e,I love this app! But I just wish that the bio part about me was just a little bit longer. I still feel like I just have a little more to say. And I wish my top spotify artists was based off of what I listen to more. Other than that its a great/ fun app!,5,2025-01-04 16:59:00,1,love app wish bio part little bit longer still feel like little say wish top spotify artist based listen great fun app,1,User Experience
4e7ddb51-b808-4a27-b21f-00533f3d33c3,nice,5,2025-01-04 16:57:26,0,nice,1,Support
eafe88dd-f669-4cc1-aa41-4741138b446f,Where are y'all going to meet people instead?,1,2025-01-04 16:53:55,3,going meet people instead,1,Content Moderation
7bdee386-c531-408a-b520-b9af8f1f899c,not allowing me to see who likes me,3,2025-01-04 16:46:09,0,allowing see like,0,Privacy
a081e597-037d-4138-a15b-2ffd83d83d23,Wasted time,1,2025-01-04 16:44:15,0,wasted time,0,Matches
2cff1111-ad31-4f28-9410-88c463010943,"I havent used this app in ages. When i did, it sucked. They will just keep taking your money even when you deactivate your account. Dont get this! I have not been able to dispute anything with them.",1,2025-01-04 16:42:37,0,havent used app age sucked keep taking money even deactivate account dont get able dispute anything,0,User Experience
db06c4a0-dbe6-4e48-b4d1-331132a74b57,Too many people with zero information on their profiles. Too many people who appear close by but living in a far away city or another country. You've got to make people put down where they live. Horrendously expensive premium services.,1,2025-01-04 16:22:24,0,many people zero information profile many people appear close living far away city another country got make people put live horrendously expensive premium service,0,User Experience
d96b66c0-8f09-476c-8cd4-ce56a3df0ae0,Great,5,2025-01-04 16:17:55,0,great,1,Performance
f6bbc024-77d0-4da3-af69-3418dca37d09,Only 25 likes for guys and 50 for girls. Fix it.,1,2025-01-04 16:02:31,0,like guy girl fix,1,Matches
2f7b010e-50dd-480b-8da7-780f9a0ce61f,good,5,2025-01-04 15:59:04,0,good,1,Support
121cbc7e-f21a-48e0-9b01-d869327e5c36,very good app,5,2025-01-04 15:58:27,0,good app,1,Performance
8ff4ed24-f547-4ef5-a12e-f699b2ef9bdd,perfect 👌,5,2025-01-04 15:55:00,0,perfect,1,Performance
0887c0d2-a295-4f19-87de-2e36c2549a99,nice,4,2025-01-04 15:50:26,0,nice,1,Support
6676d6c2-5484-4607-a246-de7184159aed,Wasted my super likes on swipe up motion while trying to see persons profile properly.. remove swipe up mechanic or at least ask for confirmation for super likes. This could be easily avoided but clearly the intention is to make you waste them on people you don't even like,1,2025-01-04 15:46:14,1,wasted super like swipe motion trying see person profile properly remove swipe mechanic least ask confirmation super like could easily avoided clearly intention make waste people even like,0,User Experience
19a16d86-f1e1-4177-9b79-9e8b2b947dd8,to expensive,3,2025-01-04 15:40:08,0,expensive,1,Pricing
a31392ec-272f-4df9-a194-b55bc0935abb,very demure,4,2025-01-04 15:24:29,0,demure,0,Content Moderation
a12dba71-4691-4d33-8276-5d5a3ddb98f2,Don't use all services are paid. Waste of time,1,2025-01-04 15:10:03,0,use service paid waste time,0,User Experience
18bb3f9e-ae86-4c94-aa04-fb98b9c788d1,supar,5,2025-01-04 15:02:19,0,supar,1,Performance
6c54bc59-ca17-4944-a9df-4edb211d7c99,Yah duniya ka sabse bekar hai ise koi download mat Karna please,1,2025-01-04 14:40:46,0,yah duniya ka sabse bekar hai ise koi download mat karna please,1,Support
d51b1a62-b106-4c68-8fd8-41e3761b1e67,too much privacy rules,3,2025-01-04 14:37:49,0,much privacy rule,0,Privacy
474c10d0-d59d-4f56-bd55-f674984b01b8,very expensive,5,2025-01-04 14:31:30,0,expensive,1,Pricing
72e09bd6-cf4c-4872-b8cb-bf179a921582,I really dnt understand why the will ask for my card number b4 I pay and nothing is free you hv to pay 4 everything,1,2025-01-04 14:03:37,0,really dnt understand ask card number b pay nothing free hv pay everything,1,Pricing
6066e71e-df6a-4df7-9707-31a53cc93b33,good,3,2025-01-04 13:46:35,0,good,1,Support
2f22c0d1-f145-455b-8f72-448a8100cd0f,"I was Ms.Ruthra once , but now this is Mrs.RuthraSanthosh leaving a beautiful comment.😘🙈",5,2025-01-04 13:29:52,0,m ruthra mr ruthrasanthosh leaving beautiful comment,1,Support
fab4b8c0-41c0-46a8-93bc-a041384501c1,nice Aap,1,2025-01-04 13:21:16,0,nice aap,1,Accessibility
2f85db1f-ee28-43d1-ae25-c4c3f1eb3379,"I created an account yesterday everything was going on fine I was about to pay for Gold when I was logged out and as to do verification which I did and the verification took since yesterday till today. Since after the verification I have not gotten any match, I can't view profile of people I was chatting with, everything seems to be offline. I need help with this so I can pay for upgrade on my account. Thank you",2,2025-01-04 13:06:38,0,created account yesterday everything going fine pay gold logged verification verification took since yesterday till today since verification gotten match view profile people chatting everything seems offline need help pay upgrade account thank,0,Matches
3de9ffe7-0449-4eb3-8b8e-de7bcdf53ff3,🫠😇,5,2025-01-04 13:03:11,0,,1,Support
9dd07e2b-88a2-49f4-a76e-fc5e7e967678,tinder discriminates trans/nonbinary people as transphobes can report their profile without actual reason and tinder just shadowbans profile and won't bother to check if there has been any violation of terms of service. If you're queer or an ally just use different app.,1,2025-01-04 12:58:05,0,tinder discriminates trans nonbinary people transphobes report profile without actual reason tinder shadowbans profile bother check violation term service queer ally use different app,0,Support
ddfd4dde-6041-416c-9eeb-399aba5b6f53,"When I bought gold tinder, no one likes me. And when I unsubscribe then it shows me that 5 people liked me and to see who it is buy a gold tinder🤦 I had gold tinder for 2 months",1,2025-01-04 12:56:34,0,bought gold tinder one like unsubscribe show people liked see buy gold tinder gold tinder month,0,Support
12da1e18-a1f1-4e37-af96-35fe9e7d4ae6,I'm so thankful to this app because i met my fiancé here 😊,5,2025-01-04 12:55:35,0,thankful app met fianc,1,User Experience
41df347d-0b7c-4a21-b061-5410282d821c,Cool,3,2025-01-04 12:36:54,0,cool,1,Support
69a92999-8a0d-438e-9c71-800c5f3825f7,good,5,2025-01-04 11:43:53,0,good,1,Support
81d06a0e-78af-4179-b6d9-3a657250f0da,horrible it won't delete my account I'm trying to start a new 1 cuz it not liking anyone for me,1,2025-01-04 11:20:03,0,horrible delete account trying start new cuz liking anyone,0,User Experience
bd37d81d-9e9b-4c24-887d-f77f59eedcd0,goodddddd,5,2025-01-04 11:19:39,0,goodddddd,1,Performance
cd1472af-1646-4937-abac-d03ad73d55b4,"Some features being locked behind a pay wall is a shame but otherwise, fantastic for an ego boost",4,2025-01-04 11:13:54,0,feature locked behind pay wall shame otherwise fantastic ego boost,0,Pricing
34207ac8-bc52-4f21-bb1b-0f0a5cfa7ed2,scam buy 20 subscriptions from Tinder and still can't message members on tinder or go back and see those who you accidentally swiped on.,1,2025-01-04 11:01:14,2,scam buy subscription tinder still message member tinder go back see accidentally swiped,0,Spam/Bots
9342a412-6285-491b-aa8c-34e842d88401,Good,4,2025-01-04 10:28:54,0,good,1,Support
dbcadebf-5744-4543-af3e-d346335953d1,"It's a very good app,I guess it's one of the best dating app if not the best.",3,2025-01-04 10:06:44,0,good app guess one best dating app best,1,Performance
7a42f56b-d199-4c96-b623-71a2d1f3f71b,Can I make a payment with verve card?,1,2025-01-04 10:01:03,0,make payment verve card,1,Accessibility
13840ecd-62ba-4d94-8b96-bb35cddbfc9d,okay,4,2025-01-04 09:59:52,0,okay,1,Content Moderation
64e3504a-3391-4933-a6e6-8040ec5ab724,messages don't always send,2,2025-01-04 09:53:56,0,message always send,1,Content Moderation
6f239526-d880-41fb-9957-00086e142395,Downloaded the app did fill in my details and uploaded my Pics. When I want to log in for the second time it keeps on saying enter phone number when I enter it send code I put and I can't log in and I already put my pics,1,2025-01-04 09:53:49,0,downloaded app fill detail uploaded pic want log second time keep saying enter phone number enter send code put log already put pic,0,Bugs
7b10be4f-0945-4c80-a516-479bbc2155ae,This app nowadays you use it for a week or two then they just burn you out of the blue..this is such a lame app,1,2025-01-04 09:21:42,0,app nowadays use week two burn blue lame app,1,User Experience
474bc736-5f48-421b-9604-45d2166ee30e,هنگام ورود کرش می‌کنه احتمالا کد ایران تحریمه,1,2025-01-04 09:12:35,0,,1,Support
04dcccb8-995d-4c3d-8327-1d9b6637c95e,App doesn't work since update. Won't allow to swipe and can't delete profile,1,2025-01-04 08:40:38,0,app work since update allow swipe delete profile,0,User Experience
d0dcac53-2c83-4770-a1a2-95eaeeefad07,good,1,2025-01-04 08:37:21,0,good,1,Support
83b31b5a-000e-46d6-b5d2-3fd134e78c43,"Was a good platform. But unfortunately I was blocked, have tried to find out exactly what to guarantee my blockage but to date have never known what I did",4,2025-01-04 08:23:13,0,good platform unfortunately blocked tried find exactly guarantee blockage date never known,0,Support
a3854a29-29d1-45b5-8b9e-49125be64c2d,good,5,2025-01-04 07:58:33,0,good,1,Support
b6a65a62-ea89-45ac-b660-dc98f71dfcac,"Face recognition verification is broken and after many, MANY attempts it will not accept my face. App is now bricked.",2,2025-01-04 07:43:54,0,face recognition verification broken many many attempt accept face app bricked,0,Performance
3ebbae43-ef42-445d-ae4b-89265164e9fa,good,4,2025-01-04 07:40:38,0,good,1,Support
8d666a6f-e625-462f-a170-428d67ed7984,"How is it that the app doesn't let you delete your account but let's you pause it, need sorting fast ( not even worth a star)",1,2025-01-04 07:23:36,0,app let delete account let pause need sorting fast even worth star,0,User Experience
1058f5ca-1cb4-423d-ae50-bc22460fb1b2,good,5,2025-01-04 07:14:15,0,good,1,Support
248221de-eef0-4e23-8bb1-0cf598fc2a41,Is there a glitch with Tinder? Can't seem to see who matches with me anymore,1,2025-01-04 06:41:29,0,glitch tinder seem see match anymore,0,Matches
9c29e0e7-ba79-42e8-b9a6-296c7c103513,"Terrible, unless you pay",1,2025-01-04 06:05:40,0,terrible unless pay,0,Pricing
502d9e43-fe8e-4b04-84d5-7351aebfe9e9,It's keeps logging me out everytime I exit the app and it keeps saying it needs to verify who I am like I'm me it's aggravating and getting really annoying,1,2025-01-04 06:05:32,0,keep logging everytime exit app keep saying need verify like aggravating getting really annoying,0,User Experience
897ef671-d885-4567-bf89-96ed2c960c5b,new to the app but had it before,4,2025-01-04 05:24:17,0,new app,1,Support
733da889-75d5-4866-90c2-8ec7b98d3ef2,lovely,5,2025-01-04 05:18:20,0,lovely,1,Content Moderation
15c64c09-0131-47ec-88d9-c1a6653dac52,"Its completely useless if you dont have the premium, they gate keep everything on this app, matches are nearly impossible, and they keep on hanging possible matched and people who liked you in your face, but wont allow you to see who they are",1,2025-01-04 05:10:02,0,completely useless dont premium gate keep everything app match nearly impossible keep hanging possible matched people liked face wont allow see,0,Matches
809887d9-a23e-4f6b-84ce-4d16d5d83de0,"it's cool and all but unless you pay for the subscription that gives you priority likes you don't get liked back that much, but if you do it's a thousand times better",4,2025-01-04 05:07:12,0,cool unless pay subscription give priority like get liked back much thousand time better,1,Pricing
e2e0f29a-b6ae-48ce-9d77-6dea68f1c14a,"They want you to spend money, I've had app for almost a year if not longer and matched maybe 15 people since.",2,2025-01-04 05:05:40,0,want spend money app almost year longer matched maybe people since,1,Matches
ac9c2796-22de-4da8-95af-b6e700a96bfc,wow,1,2025-01-04 04:30:27,0,wow,1,Matches
e216dab6-dd33-45c0-bfbc-7a865640d2d3,mid...pay to win .,1,2025-01-04 04:17:02,0,mid pay win,1,Pricing
2cedb862-953e-4e36-9b45-61636565822e,Excellent,5,2025-01-04 03:17:25,0,excellent,1,Performance
7f82b076-46f8-440b-86fe-4dfc73dd013c,The app is so useless,1,2025-01-04 03:13:18,0,app useless,1,Spam/Bots
fb1e76c4-2239-470d-8c48-d0d5b2beeb9b,What a massive letdown I guess this is for the only club kids or poly relationships,1,2025-01-04 02:53:43,0,massive letdown guess club kid poly relationship,0,Matches
3a84d2ff-a344-45d4-9da3-2d90dc7c8964,Had 6 months with subscription and absolutely 0 results. But as soon as my subscription finished I have likes! SCAM.,1,2025-01-04 02:42:03,0,month subscription absolutely result soon subscription finished like scam,0,Spam/Bots
7368f4b2-e6fa-4caa-b465-793642281577,This app sucks. The people behind tender and match group are pathetic banned people for no reason. Generic response for an appeal just worried about ripping people off and taking their money and banning them for no reason. Pathetic hopefully all the Shady stuff with what you're doing with people's info comes out one day too,1,2025-01-04 02:36:02,0,app suck people behind tender match group pathetic banned people reason generic response appeal worried ripping people taking money banning reason pathetic hopefully shady stuff people info come one day,0,Matches
